{
  "$schema": "https://json-schema.org/draft/2020-12/schema",
  "type": "object",
  "properties": {
    "schema_version": {
      "type": "string",
      "const": "1.1"
    },
    "id": {
      "type": "string",
      "pattern": "^[a-z0-9][a-z0-9_-]{0,119}$"
    },
    "project_id": {
      "type": "string",
      "pattern": "^[a-z0-9][a-z0-9_-]{0,119}$"
    },
    "title": {
      "type": "string",
      "minLength": 1,
      "maxLength": 160
    },
    "target": {
      "type": "string",
      "minLength": 1
    },
    "questions": {
      "minItems": 1,
      "maxItems": 8,
      "type": "array",
      "items": {
        "type": "string",
        "minLength": 1
      }
    },
    "scope": {
      "type": "object",
      "properties": {
        "include": {
          "type": "array",
          "items": {
            "type": "string"
          }
        },
        "exclude": {
          "type": "array",
          "items": {
            "type": "string"
          }
        }
      },
      "required": [
        "include",
        "exclude"
      ],
      "additionalProperties": false
    },
    "entry_hypotheses": {
      "default": [],
      "type": "array",
      "items": {
        "type": "string"
      }
    },
    "done_when": {
      "minItems": 1,
      "type": "array",
      "items": {
        "type": "string",
        "minLength": 1
      }
    },
    "mode": {
      "default": "guided",
      "type": "string",
      "enum": [
        "guided",
        "survey",
        "deep_dive",
        "reference"
      ]
    },
    "abstraction": {
      "type": "object",
      "properties": {
        "start_level": {
          "type": "string",
          "enum": [
            "L0",
            "L1",
            "L2",
            "L3",
            "L4",
            "L5"
          ]
        },
        "target_level": {
          "type": "string",
          "enum": [
            "L0",
            "L1",
            "L2",
            "L3",
            "L4",
            "L5"
          ]
        },
        "current_level": {
          "type": "string",
          "enum": [
            "L0",
            "L1",
            "L2",
            "L3",
            "L4",
            "L5"
          ]
        }
      },
      "required": [
        "start_level",
        "target_level",
        "current_level"
      ],
      "additionalProperties": false
    },
    "status": {
      "type": "string",
      "enum": [
        "active",
        "paused",
        "completed",
        "abandoned"
      ]
    },
    "revision": {
      "type": "object",
      "properties": {
        "branch": {
          "type": "string",
          "minLength": 1
        },
        "commit": {
          "type": "string",
          "minLength": 7
        },
        "dirty": {
          "type": "boolean"
        }
      },
      "required": [
        "branch",
        "commit",
        "dirty"
      ],
      "additionalProperties": false
    },
    "created_at": {
      "type": "string",
      "format": "date-time",
      "pattern": "^(?:(?:\\d\\d[2468][048]|\\d\\d[13579][26]|\\d\\d0[48]|[02468][048]00|[13579][26]00)-02-29|\\d{4}-(?:(?:0[13578]|1[02])-(?:0[1-9]|[12]\\d|3[01])|(?:0[469]|11)-(?:0[1-9]|[12]\\d|30)|(?:02)-(?:0[1-9]|1\\d|2[0-8])))T(?:(?:[01]\\d|2[0-3]):[0-5]\\d(?::[0-5]\\d(?:\\.\\d+)?)?(?:Z))$"
    },
    "updated_at": {
      "type": "string",
      "format": "date-time",
      "pattern": "^(?:(?:\\d\\d[2468][048]|\\d\\d[13579][26]|\\d\\d0[48]|[02468][048]00|[13579][26]00)-02-29|\\d{4}-(?:(?:0[13578]|1[02])-(?:0[1-9]|[12]\\d|3[01])|(?:0[469]|11)-(?:0[1-9]|[12]\\d|30)|(?:02)-(?:0[1-9]|1\\d|2[0-8])))T(?:(?:[01]\\d|2[0-3]):[0-5]\\d(?::[0-5]\\d(?:\\.\\d+)?)?(?:Z))$"
    }
  },
  "required": [
    "schema_version",
    "id",
    "project_id",
    "title",
    "target",
    "questions",
    "scope",
    "entry_hypotheses",
    "done_when",
    "mode",
    "abstraction",
    "status",
    "revision",
    "created_at",
    "updated_at"
  ],
  "additionalProperties": false,
  "$id": "urn:ioayn:schema:learning-goal:1.1",
  "title": "LearningGoal"
}
